Questions,True Answer in Top
get the shape of dataframe,3
how to insert a column,1
I want to iterate rows,1
I want group by keys,2
find discrete distance of the dataframe,1
allign two objects of data,0
I want to create a vertical bar plot of data,1
I wamt cummulative maximum of dataframe,1
Return me the product over axis,1
Select values at particular time.,1
How to read text from clipboard,1
How to write dataframe to XML File,2
How to Write records stored in a DataFrame to a SQL database.,3
Find label of stata file,1
How to calculate multiplication of series to another series,1
How to calculate correlation of series with another series,0
How to calculate covariance of series with other series,1
How to find skewness in series data,0
Return missing values in series of pandas,1
I want to create a new view of series. How to do that,3
return me the microseconds of date time,5
how to split a string given a seprator,1
turn a series into markdown friendly format,1