Series has,Syntax,Description:
Accessors,Perform ceil operation on the data to the specified freq.,"Series.dt.month_name(*args, **kwargs)"
Accessors,Return the month names with specified locale.,"Series.dt.day_name(*args, **kwargs)"
Accessors,Return the day names with specified locale.,Period properties
Accessors,Series.dt.qyear,Series.dt.start_time
Accessors,Get the Timestamp for the start of the period.,Series.dt.end_time
Accessors,Get the Timestamp for the end of the period.,Timedelta properties
Accessors,Series.dt.days,Number of days for each element.
Accessors,Series.dt.seconds,Number of seconds (>= 0 and less than 1 day) for each element.
Accessors,Series.dt.microseconds,Number of microseconds (>= 0 and less than 1 second) for each element.
Accessors,Series.dt.nanoseconds,Number of nanoseconds (>= 0 and less than 1 microsecond) for each element.
Accessors,Series.dt.components,Return a Dataframe of the components of the Timedeltas.
Accessors,Timedelta methods,Series.dt.to_pytimedelta()
Accessors,Return an array of native datetime.timedelta objects.,"Series.dt.total_seconds(*args, **kwargs)"
Accessors,Return total duration of each element expressed in seconds.,String handling
Accessors,Series.str can be used to access the values of the series as strings and apply several methods to it. These can be accessed like Series.str.<function/property>.,Series.str.capitalize()
Accessors,Convert strings in the Series/Index to be capitalized.,Series.str.casefold()
Accessors,Convert strings in the Series/Index to be casefolded.,"Series.str.cat([others, sep, na_rep, join])"
Accessors,Concatenate strings in the Series/Index with given separator.,"Series.str.center(width[, fillchar])"
Accessors,Pad left and right side of strings in the Series/Index.,"Series.str.contains(pat[, case, flags, na, ...])"
Accessors,Test if pattern or regex is contained within a string of a Series or Index.,"Series.str.count(pat[, flags])"
Accessors,Count occurrences of pattern in each string of the Series/Index.,"Series.str.decode(encoding[, errors])"
Accessors,Decode character string in the Series/Index using indicated encoding.,"Series.str.encode(encoding[, errors])"
Accessors,Encode character string in the Series/Index using indicated encoding.,"Series.str.endswith(pat[, na])"
Accessors,Test if the end of each string element matches a pattern.,"Series.str.extract(pat[, flags, expand])"
Accessors,Extract capture groups in the regex pat as columns in a DataFrame.,"Series.str.extractall(pat[, flags])"
Accessors,Extract capture groups in the regex pat as columns in DataFrame.,"Series.str.find(sub[, start, end])"
Accessors,Return lowest indexes in each strings in the Series/Index.,"Series.str.findall(pat[, flags])"
Accessors,Find all occurrences of pattern or regular expression in the Series/Index.,"Series.str.fullmatch(pat[, case, flags, na])"
Accessors,Determine if each string entirely matches a regular expression.,Series.str.get(i)
Accessors,Extract element from each component at specified position or with specified key.,"Series.str.index(sub[, start, end])"
Accessors,Return lowest indexes in each string in Series/Index.,Series.str.join(sep)
Accessors,Join lists contained as elements in the Series/Index with passed delimiter.,Series.str.len()
Accessors,Compute the length of each element in the Series/Index.,"Series.str.ljust(width[, fillchar])"
Accessors,Pad right side of strings in the Series/Index.,Series.str.lower()
Accessors,Convert strings in the Series/Index to lowercase.,Series.str.lstrip([to_strip])
Accessors,Remove leading characters.,"Series.str.match(pat[, case, flags, na])"
Accessors,Determine if each string starts with a match of a regular expression.,Series.str.normalize(form)
Accessors,Return the Unicode normal form for the strings in the Series/Index.,"Series.str.pad(width[, side, fillchar])"
Accessors,Pad strings in the Series/Index up to width.,"Series.str.partition([sep, expand])"
Accessors,Split the string at the first occurrence of sep.,Series.str.removeprefix(prefix)
Accessors,Remove a prefix from an object series.,Series.str.removesuffix(suffix)
Accessors,Remove a suffix from an object series.,Series.str.repeat(repeats)
Accessors,Duplicate each string in the Series or Index.,"Series.str.replace(pat, repl[, n, case, ...])"
Accessors,Replace each occurrence of pattern/regex in the Series/Index.,"Series.str.rfind(sub[, start, end])"
Accessors,Return highest indexes in each strings in the Series/Index.,"Series.str.rindex(sub[, start, end])"
Accessors,Return highest indexes in each string in Series/Index.,"Series.str.rjust(width[, fillchar])"
Accessors,Pad left side of strings in the Series/Index.,"Series.str.rpartition([sep, expand])"
Accessors,Split the string at the last occurrence of sep.,Series.str.rstrip([to_strip])
Accessors,Remove trailing characters.,"Series.str.slice([start, stop, step])"
Accessors,Slice substrings from each element in the Series or Index.,"Series.str.slice_replace([start, stop, repl])"
Accessors,Replace a positional slice of a string with another value.,"Series.str.split([pat, n, expand, regex])"
Accessors,Split strings around given separator/delimiter.,"Series.str.rsplit([pat, n, expand])"
Accessors,Split strings around given separator/delimiter.,"Series.str.startswith(pat[, na])"
Accessors,Test if the start of each string element matches a pattern.,Series.str.strip([to_strip])
Accessors,Remove leading and trailing characters.,Series.str.swapcase()
Accessors,Convert strings in the Series/Index to be swapcased.,Series.str.title()
Accessors,Convert strings in the Series/Index to titlecase.,Series.str.translate(table)
Accessors,Map all characters in the string through the given mapping table.,Series.str.upper()
Accessors,Convert strings in the Series/Index to uppercase.,"Series.str.wrap(width, **kwargs)"
Accessors,Wrap strings in Series/Index at specified line width.,Series.str.zfill(width)
Accessors,Pad strings in the Series/Index by prepending '0' characters.,Series.str.isalnum()
Accessors,Check whether all characters in each string are alphanumeric.,Series.str.isalpha()
Accessors,Check whether all characters in each string are alphabetic.,Series.str.isdigit()
Accessors,Check whether all characters in each string are digits.,Series.str.isspace()
Accessors,Check whether all characters in each string are whitespace.,Series.str.islower()
Accessors,Check whether all characters in each string are lowercase.,Series.str.isupper()
Accessors,Check whether all characters in each string are uppercase.,Series.str.istitle()
Accessors,Check whether all characters in each string are titlecase.,Series.str.isnumeric()
Accessors,Check whether all characters in each string are numeric.,Series.str.isdecimal()
Accessors,Check whether all characters in each string are decimal.,Series.str.get_dummies([sep])
Accessors,Return DataFrame of dummy/indicator variables for Series.,Categorical accessor
Accessors,Categorical-dtype specific methods and attributes are available under the Series.cat accessor.,Series.cat.categories
Accessors,The categories of this categorical.,Series.cat.ordered
Accessors,Whether the categories have an ordered relationship.,Series.cat.codes
Accessors,Return Series of codes as well as the index.,"Series.cat.rename_categories(*args, **kwargs)"
Accessors,Rename categories.,"Series.cat.reorder_categories(*args, **kwargs)"
Accessors,Reorder categories as specified in new_categories.,"Series.cat.add_categories(*args, **kwargs)"
Accessors,Add new categories.,"Series.cat.remove_categories(*args, **kwargs)"
Accessors,Remove the specified categories.,"Series.cat.remove_unused_categories(*args, ...)"
Accessors,Remove categories which are not used.,"Series.cat.set_categories(*args, **kwargs)"
Accessors,Set the categories to the specified new_categories.,"Series.cat.as_ordered(*args, **kwargs)"
Accessors,Set the Categorical to be ordered.,"Series.cat.as_unordered(*args, **kwargs)"
Accessors,Set the Categorical to be unordered.,Sparse accessor
Accessors,Sparse-dtype specific methods and attributes are provided under the Series.sparse accessor.,Series.sparse.npoints
Accessors,The number of non- fill_value points.,Series.sparse.density
Accessors,"The percent of non- fill_value points, as decimal.",Series.sparse.fill_value
Accessors,Elements in data that are fill_value are not stored.,Series.sparse.sp_values
Accessors,An ndarray containing the non- fill_value values.,"Series.sparse.from_coo(A[, dense_index])"
Accessors,Create a Series with sparse values from a scipy.sparse.coo_matrix.,"Series.sparse.to_coo([row_levels, ...])"
Accessors,Create a scipy.sparse.coo_matrix from a Series with MultiIndex.,Flags
Accessors,"Flags refer to attributes of the pandas object. Properties of the dataset (like the date is was recorded, the URL it was accessed from, etc.) should be stored in Series.attrs.","Flags(obj, *, allows_duplicate_labels)"
Accessors,Flags that apply to pandas objects.,Metadata
Accessors,Series.attrs is a dictionary for storing global metadata for this Series.,Warning
Accessors,Series.attrs is considered experimental and may change without warning.,Series.attrs
Plotting,Series.plot is both a callable method and a namespace attribute for specific plotting methods of the form Series.plot.<kind>.,"Series.plot([kind, ax, figsize, ....])"
Plotting,Series plotting accessor and method,"Series.plot.area([x, y])"
Plotting,Draw a stacked area plot.,"Series.plot.bar([x, y])"
Plotting,Vertical bar plot.,"Series.plot.barh([x, y])"
Plotting,Make a horizontal bar plot.,Series.plot.box([by])
Plotting,Make a box plot of the DataFrame columns.,"Series.plot.density([bw_method, ind])"
Plotting,Generate Kernel Density Estimate plot using Gaussian kernels.,"Series.plot.hist([by, bins])"
Plotting,Draw one histogram of the DataFrame's columns.,"Series.plot.kde([bw_method, ind])"
Plotting,Generate Kernel Density Estimate plot using Gaussian kernels.,"Series.plot.line([x, y])"
Plotting,Plot Series or DataFrame as lines.,Series.plot.pie(**kwargs)
Plotting,Generate a pie plot.,"Series.hist([by, ax, grid, xlabelsize, ...])"
Serialization / IO / conversion,"Series.to_pickle(path[, compression, ...])",Pickle (serialize) object to file.
Serialization / IO / conversion,"Series.to_csv([path_or_buf, sep, na_rep, ...])",Write object to a comma-separated values (csv) file.
Serialization / IO / conversion,Series.to_dict([into]),Convert Series to {label -> value} dict or dict-like object.
Serialization / IO / conversion,"Series.to_excel(excel_writer[, sheet_name, ...])",Write object to an Excel sheet.
Serialization / IO / conversion,Series.to_frame([name]),Convert Series to DataFrame.
Serialization / IO / conversion,Series.to_xarray(),Return an xarray object from the pandas object.
Serialization / IO / conversion,"Series.to_hdf(path_or_buf, key[, mode, ...])",Write the contained data to an HDF5 file using HDFStore.
Serialization / IO / conversion,"Series.to_sql(name, con[, schema, ...])",Write records stored in a DataFrame to a SQL database.
Serialization / IO / conversion,"Series.to_json([path_or_buf, orient, ...])",Convert the object to a JSON string.
Serialization / IO / conversion,"Series.to_string([buf, na_rep, ...])",Render a string representation of the Series.
Serialization / IO / conversion,"Series.to_clipboard([excel, sep])",Copy object to the system clipboard.
Serialization / IO / conversion,"Series.to_latex([buf, columns, col_space, ...])","Render object to a LaTeX tabular, longtable, or nested table."
Serialization / IO / conversion,"Series.to_markdown([buf, mode, index, ...])",Print Series in Markdown-friendly format.
